"episode"	"plot"	"rating"	"season"	"title"
1	"Jon organizes the North's defenses. Cersei tries to even the odds. Daenerys comes home. Arya reminds the Freys ""the North remembers."" Sam adapts to life in Oldtown. The Night King makes his way south.    "	8.7	7	"Dragonstone"
2	"Daenerys receives an unexpected visitor. Jon faces resistance. Tyrion plans the conquest of Westeros. Cersei gathers her allies. Arya has a reunion with old friends. Sam risks his career and life.    "	9.0	7	"Stormborn"
3	"Jon and Daenerys finally meet. Cersei gains a new ally. Sansa receives an unexpected visitor. Sam is confronted for his actions.    "	9.3	7	"The Queen's Justice"
4	"Daenerys takes matters into her own hands. Arya reaches her destination. Jaime and Bronn collect the spoils from the war with the Tyrells.    "	9.8	7	"The Spoils of War"
5	"Darnerys demands loyalty from the surviving Lannister soldiers; Jon heeds Bran's warning about White Walkers on the move; Cersei vows to vanquish anyone or anything that stands in her way.    "	9.0	7	"Eastwatch"
6	"Jon and his team go beyond the wall to capture a wight. Daenerys has to make a tough decision.    "	9.2	7	"Beyond the Wall"
7	"Everyone meets in King's Landing to discuss the fate of the realm. In Winterfell, Sansa confronts Arya. Sam reaches Winterfell, where he and Bran discover a shocking secret about Jon Snow.    "	9.6	7	"The Dragon and the Wolf"
1	"Jon Arryn, the Hand of the King, is dead. King Robert Baratheon plans to ask his oldest friend, Eddard Stark, to take Jon's place. Across the sea, Viserys Targaryen plans to wed his sister to a nomadic warlord in exchange for an army.    "	9.0	1	"Winter Is Coming"
2	"While Bran recovers from his fall, Ned takes only his daughters to King's Landing. Jon Snow goes with his uncle Benjen to the Wall. Tyrion joins them.    "	8.8	1	"The Kingsroad"
3	"Lord Stark and his daughters arrive at King's Landing to discover the intrigues of the king's realm.    "	8.7	1	"Lord Snow"
4	"Eddard investigates Jon Arryn's murder. Jon befriends Samwell Tarly, a coward who has come to join the Night's Watch.    "	8.8	1	"Cripples, Bastards, and Broken Things"
5	"Catelyn has captured Tyrion and plans to bring him to her sister, Lysa Arryn, at the Vale, to be tried for his, supposed, crimes against Bran. Robert plans to have Daenerys killed, but Eddard refuses to be a part of it and quits.    "	9.1	1	"The Wolf and the Lion"
6	"While recovering from his battle with Jaime, Eddard is forced to run the kingdom while Robert goes hunting. Tyrion demands a trial by combat for his freedom. Viserys is losing his patience with Drogo.    "	9.2	1	"A Golden Crown"
7	"Robert has been injured while hunting and is dying. Jon and the others finally take their vows to the Night's Watch. A man, sent by Robert, is captured for trying to poison Daenerys. Furious, Drogo vows to attack the Seven Kingdoms.    "	9.3	1	"You Win or You Die"
8	"Eddard and his men are betrayed and captured by the Lannisters. When word reaches Robb, he plans to go to war to rescue them. The White Walkers attack the Wall. Tyrion returns to his father with some new friends.    "	9.1	1	"The Pointy End"
9	"Robb goes to war against the Lannisters. Jon finds himself struggling on deciding if his place is with Robb or the Night's Watch. Drogo has fallen ill from a fresh battle wound. Daenerys is desperate to save him.    "	9.6	1	"Baelor"
10	"With Ned dead, Robb vows to get revenge on the Lannisters. Jon must officially decide if his place is with Robb or the Night's Watch. Daenerys says her final goodbye to Drogo.    "	9.5	1	"Fire and Blood"
1	"Tyrion arrives at King's Landing to take his father's place as Hand of the King. Stannis Baratheon plans to take the Iron Throne for his own. Robb tries to decide his next move in the war. The Night's Watch arrive at the house of Craster.    "	8.9	2	"The North Remembers"
2	"Arya makes friends with Gendry. Tyrion tries to take control of the Small Council. Theon arrives at his home, Pyke, in order to persuade his father into helping Robb with the war. Jon tries to investigate Craster's secret.    "	8.6	2	"The Night Lands"
3	"Tyrion tries to see who he can trust in the Small Council. Catelyn visits Renly to try and persuade him to join Robb in the war. Theon must decide if his loyalties lie with his own family or with Robb.    "	8.9	2	"What Is Dead May Never Die"
4	"Lord Baelish arrives at Renly's camp just before he faces off against Stannis. Daenerys and her company are welcomed into the city of Qarth. Arya, Gendry, and Hot Pie find themselves imprisoned at Harrenhal.    "	8.9	2	"Garden of Bones"
5	"Tyrion investigates a secret weapon that King Joffrey plans to use against Stannis. Meanwhile, as a token for saving his life, Jaqen H'ghar offers to kill three people that Arya chooses.    "	8.9	2	"The Ghost of Harrenhal"
6	"Theon seizes control of Winterfell. Jon captures a wildling, named Ygritte. The people of King's Landing begin to turn against King Joffrey. Daenerys looks to buy ships to sail for the Seven Kingdoms.    "	9.1	2	"The Old Gods and the New"
7	"Bran and Rickon have escaped Winterfell. Theon tries to hunt them down. Daenerys' dragons have been stolen. Jon travels through the wilderness with Ygritte as his prisoner. Sansa has bled and is now ready to have Joffrey's children.    "	9.0	2	"A Man Without Honor"
8	"Stannis is just days from King's Landing. Tyrion prepares for his arrival. Jon and Qhorin are taken prisoner by the wildlings. Catelyn is arrested for releasing Jaime. Arya, Gendry, and Hot Pie plan to escape from Harrenhal.    "	8.8	2	"The Prince of Winterfell"
9	"Stannis Baratheon's fleet and army arrive at King's Landing and the battle for the city begins. Cersei plans for her and her children's future.    "	9.7	2	"Blackwater"
10	"Joffrey puts Sansa aside for Margaery Tyrell. Robb marries Talisa Maegyr. Jon prepares to meet Mance Rayder. Arya says farewell to Jaqen H'ghar. Daenerys tries to rescue her dragons.    "	9.4	2	"Valar Morghulis"
1	"Jon is brought before Mance Rayder, the King Beyond the Wall, while the Night's Watch survivors retreat south. In King's Landing, Tyrion asks for his reward. Littlefinger offers Sansa a way out.    "	8.8	3	"Valar Dohaeris"
2	"Bran and company meet Jojen and Meera Reed. Arya, Gendry, and Hot Pie meet the Brotherhood. Jaime travels through the wilderness with Brienne. Sansa confesses her true feelings about Joffery to Margaery.    "	8.6	3	"Dark Wings, Dark Words"
3	"Robb and Catelyn arrive at Riverrun for Lord Hoster Tully's funeral. Tywin names Tyrion the new Master of Coin. Arya says goodbye to Hot Pie. The Night's Watch returns to Craster's. Brienne and Jaime are taken prisoner.    "	8.9	3	"Walk of Punishment"
4	"Jaime mopes over his lost hand. Cersei is growing uncomfortable with the Tyrells. The Night's Watch is growing impatient with Craster. Daenerys buys the Unsullied.    "	9.6	3	"And Now His Watch Is Ended"
5	"Robb's army is falling apart. Jaime reveals a story, to Brienne, that he has never told anyone. Jon breaks his vows. The Hound is granted his freedom. The Lannisters hatch a new plan.    "	9.0	3	"Kissed by Fire"
6	"Jon and the wildlings scale the Wall. The Brotherhood sells Gendry to Melisandre. Robb does what he can to win back the Freys. Tyrion tells Sansa about their engagement.    "	8.8	3	"The Climb"
7	"Jon and the wildlings travel south of the Wall. Talisa tells Robb that she's pregnant. Arya runs away from the Brotherhood. Daenerys arrives at Yunkai. Jaime leaves Brienne behind at Harrenhal.    "	8.8	3	"The Bear and the Maiden Fair"
8	"Daenerys tries to persuade the Second Sons to join her against Yunkai. Stannis releases Davos from the dungeons. Sam and Gilly are attacked by a White Walker. Sansa and Tyrion wed.    "	9.0	3	"Second Sons"
9	"Robb and Catelyn arrive at the Twins for the wedding. Jon is put to the test to see where his loyalties truly lie. Bran's group decides to split up. Daenerys plans an invasion of Yunkai.    "	9.9	3	"The Rains of Castamere"
10	"Bran and company travel beyond the Wall. Sam returns to Castle Black. Jon says goodbye to Ygritte. Jaime returns to King's Landing. The Night's Watch asks for help from Stannis.    "	9.2	3	"Mhysa"
1	"Tyrion welcomes a guest to King's Landing. At Castle Black, Jon stands trial. Daenerys is pointed to Meereen, the mother of all slave cities. Arya runs into an old enemy.    "	9.1	4	"Two Swords"
2	"Joffrey and Margaery's wedding has come. Tyrion breaks up with Shae. Ramsay tries to prove his worth to his father. Bran and company find a Weirwood tree.    "	9.7	4	"The Lion and the Rose"
3	"Tyrion is arrested for the murder of Joffery and awaits trial. Sansa escapes King's Landing. Sam sends Gilly to Mole's Town as the Night's Watch finds itself in a tight spot. Meereen challenges Daenerys.    "	8.9	4	"Breaker of Chains"
4	"Jaime entrusts a task to Brienne. Daenerys frees Meereen. Jon is given permission to lead a group of Night's Watchmen to Craster's Keep. Bran and company are taken hostage.    "	8.9	4	"Oathkeeper"
5	"Tommen is crowned King of the Seven Kingdoms. Cersei builds her case against Tyrion. Sansa and Lord Baelish arrive at the Eyrie. The Night's Watch attacks Craster's Keep.    "	8.8	4	"First of His Name"
6	"Tyrion's trial has come. Yara and her troops storm the Dreadfort to free Theon. Daenerys meets Hizdar zo Loraq. Stannis makes a deal with the Iron Bank of Braavos.    "	9.7	4	"The Laws of Gods and Men"
7	"Tyrion tries to find a champion. Daenerys sleeps with Daario. The Hound becomes wounded. Jon's advice is ignored at Castle Black. Brienne and Podrick receive a tip on Arya's whereabouts.    "	9.2	4	"Mockingbird"
8	"Theon helps Ramsay seize Moat Cailin. The wildlings attack Mole's Town. Sansa comes up with a story to protect Lord Baelish. Daenerys finds out a secret about Jorah Mormont. Oberyn Martell faces Gregor Clegane, the Mountain.    "	9.7	4	"The Mountain and the Viper"
9	"The battle between the Night's Watch and the wildlings has come.    "	9.6	4	"The Watchers on the Wall"
10	"Jon makes an important decision. Daenerys experiences new consequences. Brienne and Podrick have an unexpected encounter. Bran achieves a goal, while Tyrion makes an important discovery.    "	9.7	4	"The Children"
1	"Cersei and Jaime adjust to a world without Tywin. Tyrion and Varys arrive at Pentos. In Meereen, a new enemy emerges. Jon is caught between two kings.    "	8.6	5	"The Wars to Come"
2	"Arya arrives in Braavos. Jaime takes on a secret mission. Ellaria Sand seeks revenge for Oberyn's death. Stannis makes Jon a generous offer as the Night's Watch elects a new Lord Commander. Daenerys is faced with a difficult decision.    "	8.6	5	"The House of Black and White"
3	"Tommen and Margaery wed. Arya has trouble adapting to her new life. Littlefinger reveals his plans to Sansa. Jon gives his first orders as Lord Commander. Tyrion and Varys arrive in Volantis.    "	8.6	5	"High Sparrow"
4	"Jorah Mormont sets sail alongside his prisoner, Tyrion. Cersei makes a move against the Tyrells. Jaime and Bronn sneak into Dorne. Ellaria and the Sand Snakes make their plans. Melisandre tempts Jon. The Harpies attack.    "	8.8	5	"Sons of the Harpy"
5	"Daenerys arrests the heads of Meereen's great families. Jon makes a difficult decision. Theon is forced to face Sansa. Stannis rides south. Tyrion and Jorah enter the ruins of Old Valyria.    "	8.7	5	"Kill the Boy"
6	"Arya is put to the test. Tyrion and Jorah are captured by slavers. Loras Tyrell is judged by the Sparrows. Jaime and Bronn face the Sand Snakes. Sansa marries Ramsay Bolton.    "	8.1	5	"Unbowed, Unbent, Unbroken"
7	"Jon heads east as trouble begins to stir for Sam and Gilly at Castle Black. Sansa asks Theon for help. Tyrion and Jorah are sold as slaves. Cersei savors her triumph over the Tyrells as new plots are developed in the shadows.    "	9.1	5	"The Gift"
8	"Tyrion advises Daenerys. Sansa forces Theon to tell her a secret. Cersei remains stubborn. Arya meets her first target. Jon and Tormund meet with the wildling elders.    "	9.9	5	"Hardhome"
9	"Jon and the wildlings return to Castle Black. Jaime meets with Doran Martell. Stannis makes a hard choice. Arya runs into Meryn Trant. Daenerys attends the grand reopening of the fighting pits.    "	9.5	5	"The Dance of Dragons"
10	"Stannis arrives at Winterfell. Tyrion runs Meereen as Daario and Jorah go after Daenerys. Jaime and Myrcella leave Dorne. Jon sends Sam and Gilly to Oldtown. Arya challenges the Many-Faced God. Cersei confesses her sins.    "	9.0	5	"Mother's Mercy"
1	"The fate of Jon Snow is revealed. Daenerys is brought before Khal Moro. Tyrion gets used to living in Meereen. Ramsay sends his dogs after Theon and Sansa. Ellaria and the Sand Snakes make their move. Cersei mourns for Myrcella.    "	8.6	6	"The Red Woman"
2	"Bran trains with the Three-Eyed Raven. Tommen meets with Cersei. Tyrion makes a bold move. Theon leaves while at Pyke new issues arise. Ramsay's brother is born. Davos asks Melisandre for a miracle.    "	9.5	6	"Home"
3	"Daenerys arrives at Vaes Dothrak. Sam and Gilly sail for Horn Hill. Arya trains as No One. Varys finds information on the Sons of the Harpy. Ramsay receives a gift. Tommen meets with the High Sparrow. At Castle Black, a miracle occurs.    "	8.8	6	"Oathbreaker"
4	"Sansa arrives at Castle Black. Tyrion makes a deal with the slave masters. Jorah and Daario sneak into Vaes Dothrak. Ramsay sends a letter to Jon. Theon arrives at Pyke. Cersei and Olenna Tyrell plot against the High Sparrow.    "	9.2	6	"Book of the Stranger"
5	"Sansa and Jon make plans. Arya is given another chance to prove herself. Jorah confesses a secret to Daenerys. Tyrion meets with a red priestess. Yara finds her rule tested. Bran discovers the origin of the White Walkers.    "	9.7	6	"The Door"
6	"Bran and Meera find a new ally. Gilly meets Sam's family. Arya makes a difficult choice. The Lannisters and Tyrells march against the High Sparrow.    "	8.5	6	"Blood of My Blood"
7	"Jon and Sansa gather troops. Jaime arrives at Riverrun. Olenna Tyrell plans to leave King's Landing. Theon and Yara plan a destination. Arya makes plans to leave.    "	8.6	6	"The Broken Man"
8	"Brienne arrives at Riverrun. Arya seeks shelter. Jaime meets with Edmure Tully. Cersei challenges the Faith. Sandor Clegane hunts for revenge. Tyrion faces the consequences of earlier decisions.    "	8.4	6	"No One"
9	"Jon and Sansa face Ramsay Bolton on the fields of Winterfell. Daenerys strikes back at her enemies. Theon and Yara arrive in Meereen.    "	9.9	6	"Battle of the Bastards"
10	"Cersei and Loras Tyrell stand trial by the gods. Daenerys prepares to set sail for Westeros. Davos confronts Melisandre. Sam and Gilly arrive in the Citadel. Bran discovers a long-kept secret. Lord Frey has an uninvited guest.    "	9.9	6	"The Winds of Winter"
